{
  "services": [
    {
      "id": "frontend",
      "name": "frontend",
      "replicas": 1
    },
    {
      "id": "checkout",
      "name": "checkout",
      "replicas": 1
    }
  ],
  "edges": [],
  "endpoints": [
    {
      "id": "frontend:GET /health",
      "entry_service": "frontend",
      "success_predicate_ref": "frontend:GET /health"
    }
  ],
  "metadata": {
    "source_type": "bering",
    "source_ref": "bering://fixture/model.disconnected",
    "discovered_at": "2026-03-03T00:00:00Z",
    "confidence": 0.8,
    "schema": {
      "name": "io.mb3r.bering.model",
      "version": "1.3.0",
      "uri": "https://mb3r-lab.github.io/Bering/schema/model/v1.3.0/model.schema.json",
      "digest": "sha256:2aa8a3550a25dc626ba6d2f5833569efca2f382b9e5c9c3405be93695d7d48ae"
    }
  }
}
